{
  "round_id": "019a2b3c-4d5e-7f00-8a00-000000000021",
  "shift_id": "019a2b3c-4d5e-7f00-8a00-000000000020",
  "route_version_id": "019a2b3c-4d5e-7f00-8a00-000000000008",
  "schedule_id": "019a2b3c-4d5e-7f00-8a00-000000000009",
  "scheduled_at": "2026-10-27T20:00:00.000Z",
  "time_limit_min": null
}
